{"version":"0.1","type":"architecture","nodes":[{"id":"a","label":"A","position":{"x":100,"y":100}},{"id":"b","label":"B","position":{"x":400,"y":300}},{"id":"c","label":"C","position":{"x":100,"y":300}},{"id":"d","label":"D","position":{"x":400,"y":100}}],"edges":[{"from":"a","to":"b"},{"from":"c","to":"d"}]}
