{"version":"0.1","type":"architecture","nodes":[{"id":"a","label":"A","position":{"x":100,"y":400}},{"id":"b","label":"B","position":{"x":600,"y":400}},{"id":"top","label":"Wall","position":{"x":350,"y":200},"size":{"width":100,"height":400}},{"id":"bottom","label":"Wall","position":{"x":350,"y":600},"size":{"width":100,"height":400}}],"edges":[{"from":"a","to":"b"},{"from":"a","to":"top"},{"from":"a","to":"bottom"}]}
